{
  "artifact_bindings": {
    "universal_live_capability_discovery_contract": {
      "artifact_hash": "589eeebc8a6afa913fa9b39d31b2df60b1565e1f3ee9a8d282fad8c87035c667",
      "hash_reproducible": true,
      "level": "RDLLM-L182",
      "minimum_level": "RDLLM-L182",
      "payload_hash": "589eeebc8a6afa913fa9b39d31b2df60b1565e1f3ee9a8d282fad8c87035c667",
      "present": true,
      "ready": true,
      "status": "ready"
    },
    "universal_verified_source_footer_contract": {
      "artifact_hash": "ba3d22c8afab4673494206372918cf1dfe836fb8d95b3e26c0b582f54fc5c8a1",
      "hash_reproducible": true,
      "level": "RDLLM-L180",
      "minimum_level": "RDLLM-L180",
      "payload_hash": "ba3d22c8afab4673494206372918cf1dfe836fb8d95b3e26c0b582f54fc5c8a1",
      "present": true,
      "ready": true,
      "status": "ready"
    }
  },
  "checks": {
    "contract_signed": true,
    "footer_binding_rows_complete": true,
    "live_capability_discovery_l182_ready": true,
    "native_annotation_format_rows_complete": true,
    "negative_native_annotation_fixtures_reject": true,
    "normalization_field_rows_complete": true,
    "route_annotation_rows_complete": true,
    "verified_source_footer_l180_ready": true
  },
  "coverage": {
    "incomplete_footer_bindings": [],
    "incomplete_native_annotation_formats": [],
    "incomplete_negative_native_annotation_failures": [],
    "incomplete_normalization_fields": [],
    "incomplete_route_annotations": [],
    "l182_route_ids": [
      "reference-route:cloud_hosted_provider:fine_tuning:13",
      "reference-route:cloud_hosted_provider:reasoning:1",
      "reference-route:embedding_provider:tool_calling_agent:10",
      "reference-route:enterprise_private_model:audio_speech:5",
      "reference-route:enterprise_private_model:gateway_router:17",
      "reference-route:fine_tuning_provider:batch_generation:11",
      "reference-route:foundation_provider:streaming:12",
      "reference-route:foundation_provider:text_chat:0",
      "reference-route:hosted_open_weight_service:image_generation:4",
      "reference-route:hosted_open_weight_service:local_inference:16",
      "reference-route:local_runtime:video_generation:6",
      "reference-route:model_marketplace:long_context:2",
      "reference-route:model_marketplace:retrieval_augmented:14",
      "reference-route:multimodal_media_provider:code_generation:9",
      "reference-route:open_weight_registry:embedding:7",
      "reference-route:regional_sovereign_provider:reranking:8",
      "reference-route:router_or_gateway:multimodal_vision:3",
      "reference-route:router_or_gateway:safety_moderation:15"
    ],
    "mismatched_footer_bindings": [],
    "mismatched_route_annotations": [],
    "missing_footer_bindings": [],
    "missing_native_annotation_formats": [],
    "missing_negative_native_annotation_failures": [],
    "missing_normalization_fields": [],
    "missing_route_annotations": []
  },
  "created_at": "2026-06-03T00:00:00Z",
  "evidence_roots": {
    "combined_native_source_annotation_root": "8615dccd2f451284266b657af3ad62c9b4dee6915b46189b4e3c1eba4628c198",
    "footer_binding_root": "701998a2e39a5cf22dfc2a4aaaf9eeb29480a624d5c8d28ed22b13ff6db1b936",
    "native_annotation_format_root": "2faebe2a901070930f44ede924c586995ca8bc420cfae632ac53aa417bff9af0",
    "negative_native_annotation_root": "d9cf0ca1447e182fe58f9ee0f2582167dc46982e9ccb270f28b58e76b246bb08",
    "normalization_field_root": "bd07280c85457c51b539a2acb6df6d0e3b587c1feb5a375c077dbf005b0e3f54",
    "route_annotation_root": "3f427e61d1b4a12f2367d2e2318761fee0d024195f17d130ee510410b6fd19c8"
  },
  "footer_binding_rows": {
    "reference-route:cloud_hosted_provider:fine_tuning:13": {
      "claim_span_hash": "e422803c704646fbb2b27d966040f9c56facf4f2d1afbece1bfc75da4a11a810",
      "claim_span_preserved": true,
      "footer_binding_hash": "650e729ea6cb00306b7f2056a058ce99b53aa87cda9ef5679ffe5057f7dcf8dc",
      "footer_row_hash": "979bb30734270a4c644c1ade387426e0fb1cfe81f711c80cf83e52682a50ed38",
      "footer_row_visible_or_abstained": true,
      "metadata_fidelity_checked": true,
      "native_annotation_bound": true,
      "native_annotation_hash": "34edb50b52abc82e2f246c257fdcc5f851619cafad345ca96763a938265be7e4",
      "no_private_payloads": true,
      "route_id": "reference-route:cloud_hosted_provider:fine_tuning:13",
      "source_identity_hash": "e81a7e10d22292f122dc462764c5fdaa20f32c6aaf0019b6257fff09a076fdb3",
      "source_locator_preserved": true,
      "verified_footer_hash": "ba3d22c8afab4673494206372918cf1dfe836fb8d95b3e26c0b582f54fc5c8a1",
      "verifier_hash": "d6c2b5859e000a5254168fb3ac2cc211797f58e1565ab12964515ecef852d7db"
    },
    "reference-route:cloud_hosted_provider:reasoning:1": {
      "claim_span_hash": "56fa12c51aa33615b3d4ac298b5accebea4b38685136fd8151be4291488395ac",
      "claim_span_preserved": true,
      "footer_binding_hash": "f8b3a64e36968e6a50b9eb5824ed62406e4b08090151979a78001afb8f7644b2",
      "footer_row_hash": "676748da15cc2477f12609d9e147977689061d2822502eaa8fe556ede9a5b973",
      "footer_row_visible_or_abstained": true,
      "metadata_fidelity_checked": true,
      "native_annotation_bound": true,
      "native_annotation_hash": "ddcbced2a20e281548e12733deae297e53b023cca25629785bae75526fc772ea",
      "no_private_payloads": true,
      "route_id": "reference-route:cloud_hosted_provider:reasoning:1",
      "source_identity_hash": "0c4d4afed5c0536f31b2c8f31013f3d9d2e5ea5fe0baacbb25626f11a5ce31cd",
      "source_locator_preserved": true,
      "verified_footer_hash": "ba3d22c8afab4673494206372918cf1dfe836fb8d95b3e26c0b582f54fc5c8a1",
      "verifier_hash": "2a73f44cbef1210222ed3d3eea31b241922c60f8955b7f5aa2ee93468e43fedb"
    },
    "reference-route:embedding_provider:tool_calling_agent:10": {
      "claim_span_hash": "0804882931ed1a82978e1dac604981fecda52c7a5ebb8969c362537d9e570aae",
      "claim_span_preserved": true,
      "footer_binding_hash": "549d8a490772ba3527e3ad60a17f8e42747cf112a408da4b36810d0a442eab2a",
      "footer_row_hash": "721672cc2d4f7b6cf3eafc2e728bfac8f076fa3b8c8a0bd55e4539d247429702",
      "footer_row_visible_or_abstained": true,
      "metadata_fidelity_checked": true,
      "native_annotation_bound": true,
      "native_annotation_hash": "2ec4c44726685a7051301e081a373b408c90cb27c4dd1777beae27d620d27d43",
      "no_private_payloads": true,
      "route_id": "reference-route:embedding_provider:tool_calling_agent:10",
      "source_identity_hash": "1e2650f432586d4d9a503d3e732cfbef05e24944ffadd7b31aa9f37b69493824",
      "source_locator_preserved": true,
      "verified_footer_hash": "ba3d22c8afab4673494206372918cf1dfe836fb8d95b3e26c0b582f54fc5c8a1",
      "verifier_hash": "889ac076c07aa8541821d609b1fa4b53385229e66cf6fc9df9381e51b88b6790"
    },
    "reference-route:enterprise_private_model:audio_speech:5": {
      "claim_span_hash": "9d8792a8065365cb774b8bec4444c805de0ed9f58054624f3d80af03ee9a0797",
      "claim_span_preserved": true,
      "footer_binding_hash": "25ac433b0b1ba0a869314b39b7e027dfda4755f13de735816da93487d994aec6",
      "footer_row_hash": "8b2adbcff5562dabc3babef0b5811accb4f777205bb84b33216cb6a140ed6904",
      "footer_row_visible_or_abstained": true,
      "metadata_fidelity_checked": true,
      "native_annotation_bound": true,
      "native_annotation_hash": "33528a7f92d1217ed896bcd869586348e1f9d345c3fab75c274757c9142835e9",
      "no_private_payloads": true,
      "route_id": "reference-route:enterprise_private_model:audio_speech:5",
      "source_identity_hash": "3ff0a3fa56a1c9d88e40fe2c0490102c6b0a61db391b07a56d3acbd7a8b1ecbb",
      "source_locator_preserved": true,
      "verified_footer_hash": "ba3d22c8afab4673494206372918cf1dfe836fb8d95b3e26c0b582f54fc5c8a1",
      "verifier_hash": "314d3e78c4448f714a4e2c31ad32d378dd565a7c2bb926c4ce9a3482285650b5"
    },
    "reference-route:enterprise_private_model:gateway_router:17": {
      "claim_span_hash": "1372711c3cf4614f2e32493578ec01f0501f20e11883b9431c8f3f1fc9cfea10",
      "claim_span_preserved": true,
      "footer_binding_hash": "7e3124d919beb22bdd649040d50539d181eda394be76a41591831b01266c128c",
      "footer_row_hash": "962e13832000efd2e66b891837446e0663acdcda4c03d70398653d89706902fb",
      "footer_row_visible_or_abstained": true,
      "metadata_fidelity_checked": true,
      "native_annotation_bound": true,
      "native_annotation_hash": "19775f53b5ce9410db30faff30aa290081fb3b2a771d72d3f4cd20d3e4ae7855",
      "no_private_payloads": true,
      "route_id": "reference-route:enterprise_private_model:gateway_router:17",
      "source_identity_hash": "dbdf2937cff70d834963025c34c59a927a74dc7373c36f0e01a26b1ec7283171",
      "source_locator_preserved": true,
      "verified_footer_hash": "ba3d22c8afab4673494206372918cf1dfe836fb8d95b3e26c0b582f54fc5c8a1",
      "verifier_hash": "22d679bd38acfeedfced8d70a62d459f04aa5f410b566474f4077f5e03b7bba6"
    },
    "reference-route:fine_tuning_provider:batch_generation:11": {
      "claim_span_hash": "093d1dd0bcfac4f642b13c24f2d7fa5d821905e3e17941438d6a1bc8468db271",
      "claim_span_preserved": true,
      "footer_binding_hash": "865f5c11ffbf0a6324c71531c2b527c14cd76293139722f2465e48635516a3e0",
      "footer_row_hash": "c88d8e795e8156f35cc014283936e2f7ef3b68eee67c6e0c77526f8d7f6326e7",
      "footer_row_visible_or_abstained": true,
      "metadata_fidelity_checked": true,
      "native_annotation_bound": true,
      "native_annotation_hash": "6e917bc2406dcae1b5309ae95074742afb230105351d0a49193af16b5850ffe9",
      "no_private_payloads": true,
      "route_id": "reference-route:fine_tuning_provider:batch_generation:11",
      "source_identity_hash": "80af733d044a3a9761de493994e18a5084610f8571a764372c4e677f269c0e18",
      "source_locator_preserved": true,
      "verified_footer_hash": "ba3d22c8afab4673494206372918cf1dfe836fb8d95b3e26c0b582f54fc5c8a1",
      "verifier_hash": "b32fd63bbd8f0d527d419afa923e7dd5013db456021f504cdfe061d04a703a11"
    },